{
  "version": 1,
  "song": {
    "id": "example",
    "title": "Example (synthetic 120 BPM)",
    "durationSec": 8.0,
    "bpm": 120.0,
    "beats": [
      0.0,
      0.5,
      1.0,
      1.5,
      2.0,
      2.5,
      3.0,
      3.5,
      4.0,
      4.5,
      5.0,
      5.5,
      6.0,
      6.5,
      7.0,
      7.5
    ],
    "downbeats": [
      0.0,
      2.0,
      4.0,
      6.0
    ],
    "sections": [
      {
        "start": 0.0,
        "end": 4.0,
        "label": "verse",
        "energy": 0.4
      },
      {
        "start": 4.0,
        "end": 8.0,
        "label": "chorus",
        "energy": 0.9
      }
    ]
  },
  "difficulty": "easy",
  "mode": "standing",
  "seed": 42,
  "moves": [
    {
      "id": "arm_raise_R",
      "name": "Right Arm Up",
      "startBeat": 0,
      "lengthBeats": 4,
      "startTime": 0.0,
      "endTime": 2.0,
      "intensity": 2,
      "scoredJoints": [
        "r_elbow",
        "r_wrist"
      ],
      "keyframes": [
        {
          "t": 0.0,
          "pose": {
            "nose": [
              0.0,
              -1.45
            ],
            "l_eye": [
              -0.07,
              -1.52
            ],
            "r_eye": [
              0.07,
              -1.52
            ],
            "l_ear": [
              -0.15,
              -1.48
            ],
            "r_ear": [
              0.15,
              -1.48
            ],
            "l_shoulder": [
              -0.45,
              -1.0
            ],
            "r_shoulder": [
              0.45,
              -1.0
            ],
            "l_elbow": [
              -0.52,
              -0.42
            ],
            "r_elbow": [
              0.52,
              -0.42
            ],
            "l_wrist": [
              -0.55,
              0.12
            ],
            "r_wrist": [
              0.55,
              0.12
            ],
            "l_hip": [
              -0.22,
              0.0
            ],
            "r_hip": [
              0.22,
              0.0
            ],
            "l_knee": [
              -0.22,
              0.95
            ],
            "r_knee": [
              0.22,
              0.95
            ],
            "l_ankle": [
              -0.22,
              1.85
            ],
            "r_ankle": [
              0.22,
              1.85
            ]
          }
        },
        {
          "t": 0.5,
          "pose": {
            "nose": [
              0.0,
              -1.45
            ],
            "l_eye": [
              -0.07,
              -1.52
            ],
            "r_eye": [
              0.07,
              -1.52
            ],
            "l_ear": [
              -0.15,
              -1.48
            ],
            "r_ear": [
              0.15,
              -1.48
            ],
            "l_shoulder": [
              -0.45,
              -1.0
            ],
            "r_shoulder": [
              0.45,
              -1.0
            ],
            "l_elbow": [
              -0.52,
              -0.42
            ],
            "r_elbow": [
              0.62,
              -1.55
            ],
            "l_wrist": [
              -0.55,
              0.12
            ],
            "r_wrist": [
              0.7,
              -2.1
            ],
            "l_hip": [
              -0.22,
              0.0
            ],
            "r_hip": [
              0.22,
              0.0
            ],
            "l_knee": [
              -0.22,
              0.95
            ],
            "r_knee": [
              0.22,
              0.95
            ],
            "l_ankle": [
              -0.22,
              1.85
            ],
            "r_ankle": [
              0.22,
              1.85
            ]
          }
        },
        {
          "t": 1.0,
          "pose": {
            "nose": [
              0.0,
              -1.45
            ],
            "l_eye": [
              -0.07,
              -1.52
            ],
            "r_eye": [
              0.07,
              -1.52
            ],
            "l_ear": [
              -0.15,
              -1.48
            ],
            "r_ear": [
              0.15,
              -1.48
            ],
            "l_shoulder": [
              -0.45,
              -1.0
            ],
            "r_shoulder": [
              0.45,
              -1.0
            ],
            "l_elbow": [
              -0.52,
              -0.42
            ],
            "r_elbow": [
              0.52,
              -0.42
            ],
            "l_wrist": [
              -0.55,
              0.12
            ],
            "r_wrist": [
              0.55,
              0.12
            ],
            "l_hip": [
              -0.22,
              0.0
            ],
            "r_hip": [
              0.22,
              0.0
            ],
            "l_knee": [
              -0.22,
              0.95
            ],
            "r_knee": [
              0.22,
              0.95
            ],
            "l_ankle": [
              -0.22,
              1.85
            ],
            "r_ankle": [
              0.22,
              1.85
            ]
          }
        }
      ]
    },
    {
      "id": "arm_raise_L",
      "name": "Left Arm Up",
      "startBeat": 4,
      "lengthBeats": 4,
      "startTime": 2.0,
      "endTime": 4.0,
      "intensity": 2,
      "scoredJoints": [
        "l_elbow",
        "l_wrist"
      ],
      "keyframes": [
        {
          "t": 0.0,
          "pose": {
            "nose": [
              0.0,
              -1.45
            ],
            "l_eye": [
              -0.07,
              -1.52
            ],
            "r_eye": [
              0.07,
              -1.52
            ],
            "l_ear": [
              -0.15,
              -1.48
            ],
            "r_ear": [
              0.15,
              -1.48
            ],
            "l_shoulder": [
              -0.45,
              -1.0
            ],
            "r_shoulder": [
              0.45,
              -1.0
            ],
            "l_elbow": [
              -0.52,
              -0.42
            ],
            "r_elbow": [
              0.52,
              -0.42
            ],
            "l_wrist": [
              -0.55,
              0.12
            ],
            "r_wrist": [
              0.55,
              0.12
            ],
            "l_hip": [
              -0.22,
              0.0
            ],
            "r_hip": [
              0.22,
              0.0
            ],
            "l_knee": [
              -0.22,
              0.95
            ],
            "r_knee": [
              0.22,
              0.95
            ],
            "l_ankle": [
              -0.22,
              1.85
            ],
            "r_ankle": [
              0.22,
              1.85
            ]
          }
        },
        {
          "t": 0.5,
          "pose": {
            "nose": [
              0.0,
              -1.45
            ],
            "l_eye": [
              -0.07,
              -1.52
            ],
            "r_eye": [
              0.07,
              -1.52
            ],
            "l_ear": [
              -0.15,
              -1.48
            ],
            "r_ear": [
              0.15,
              -1.48
            ],
            "l_shoulder": [
              -0.45,
              -1.0
            ],
            "r_shoulder": [
              0.45,
              -1.0
            ],
            "l_elbow": [
              -0.62,
              -1.55
            ],
            "r_elbow": [
              0.52,
              -0.42
            ],
            "l_wrist": [
              -0.7,
              -2.1
            ],
            "r_wrist": [
              0.55,
              0.12
            ],
            "l_hip": [
              -0.22,
              0.0
            ],
            "r_hip": [
              0.22,
              0.0
            ],
            "l_knee": [
              -0.22,
              0.95
            ],
            "r_knee": [
              0.22,
              0.95
            ],
            "l_ankle": [
              -0.22,
              1.85
            ],
            "r_ankle": [
              0.22,
              1.85
            ]
          }
        },
        {
          "t": 1.0,
          "pose": {
            "nose": [
              0.0,
              -1.45
            ],
            "l_eye": [
              -0.07,
              -1.52
            ],
            "r_eye": [
              0.07,
              -1.52
            ],
            "l_ear": [
              -0.15,
              -1.48
            ],
            "r_ear": [
              0.15,
              -1.48
            ],
            "l_shoulder": [
              -0.45,
              -1.0
            ],
            "r_shoulder": [
              0.45,
              -1.0
            ],
            "l_elbow": [
              -0.52,
              -0.42
            ],
            "r_elbow": [
              0.52,
              -0.42
            ],
            "l_wrist": [
              -0.55,
              0.12
            ],
            "r_wrist": [
              0.55,
              0.12
            ],
            "l_hip": [
              -0.22,
              0.0
            ],
            "r_hip": [
              0.22,
              0.0
            ],
            "l_knee": [
              -0.22,
              0.95
            ],
            "r_knee": [
              0.22,
              0.95
            ],
            "l_ankle": [
              -0.22,
              1.85
            ],
            "r_ankle": [
              0.22,
              1.85
            ]
          }
        }
      ]
    },
    {
      "id": "t_pose",
      "name": "Star Pose",
      "startBeat": 8,
      "lengthBeats": 8,
      "startTime": 4.0,
      "endTime": 8.0,
      "intensity": 3,
      "scoredJoints": [
        "l_elbow",